{
  "$schema": "https://json-schema.org/draft/2020-12/schema",
  "$id": "https://github.com/prefix-dev/purl-associator/schemas/cve-package.schema.json",
  "title": "purl-associator per-package CVE file",
  "description": "Envelope written by scripts/cve_match.py to mappings/cves/<pkg>.json. Each entry of `advisories` is a verbatim OSV record (validated separately against schemas/osv-schema.json) carrying the conda-forge match under database_specific['conda-forge'].",
  "type": "object",
  "required": ["schema_version", "package", "generated_at", "advisories"],
  "additionalProperties": false,
  "properties": {
    "schema_version": { "type": "integer", "const": 1 },
    "package": { "type": "string", "minLength": 1 },
    "purls": { "type": "array", "items": { "type": "string" } },
    "generated_at": { "type": "string" },
    "conda_versions_total": { "type": "integer", "minimum": 0 },
    "advisories": {
      "type": "array",
      "items": {
        "type": "object",
        "required": ["id", "modified", "database_specific"],
        "properties": {
          "id": { "type": "string" },
          "database_specific": {
            "type": "object",
            "required": ["conda-forge"],
            "properties": {
              "conda-forge": {
                "type": "object",
                "required": ["package", "purl", "affected_versions"],
                "properties": {
                  "package": { "type": "string" },
                  "purl": { "type": "string", "pattern": "^pkg:conda/" },
                  "source_purls": { "type": "array", "items": { "type": "string" } },
                  "affected_versions": { "type": "array", "items": { "type": "string" } },
                  "conda_versions_total": { "type": "integer", "minimum": 0 },
                  "derived_by": { "type": "string" },
                  "generated_at": { "type": "string" }
                }
              }
            }
          }
        }
      }
    }
  }
}
