{
  "schema_version": 1,
  "package": "apache-airflow-providers-docker",
  "purls": [
    "pkg:pypi/apache-airflow-providers-docker"
  ],
  "generated_at": "2026-05-23T06:36:22+00:00",
  "conda_versions_total": 59,
  "advisories": [
    {
      "schema_version": "1.7.3",
      "id": "GHSA-746v-hfh2-xphm",
      "published": "2022-08-17T00:00:21Z",
      "modified": "2024-12-06T05:29:25.232962Z",
      "aliases": [
        "CVE-2022-38362"
      ],
      "summary": "Remote code execution in Apache Airflow Docker's Provider",
      "details": "Apache Airflow Docker's Provider prior to 3.0.0 shipped with an example DAG that was vulnerable to (authenticated) remote code exploit of code on the Airflow worker host. Disable loading of example DAGs or upgrade apache-airflow-providers-docker to 3.0.0 or above.",
      "affected": [
        {
          "package": {
            "name": "apache-airflow-providers-docker",
            "ecosystem": "PyPI",
            "purl": "pkg:pypi/apache-airflow-providers-docker"
          },
          "ranges": [
            {
              "type": "ECOSYSTEM",
              "events": [
                {
                  "introduced": "0"
                },
                {
                  "fixed": "3.0.0"
                }
              ]
            }
          ],
          "versions": [
            "1.0.0",
            "1.0.0b1",
            "1.0.0b2",
            "1.0.0rc1",
            "1.0.1",
            "1.0.1rc1",
            "1.0.2",
            "1.0.2rc1",
            "1.1.0",
            "1.1.0rc1",
            "1.2.0",
            "1.2.0rc1",
            "2.0.0",
            "2.0.0rc1",
            "2.0.0rc2",
            "2.1.0",
            "2.1.0rc1",
            "2.1.0rc2",
            "2.1.1",
            "2.1.1rc1",
            "2.2.0",
            "2.2.0rc1",
            "2.3.0",
            "2.3.0rc1",
            "2.4.0",
            "2.4.0rc1",
            "2.4.1",
            "2.4.1rc1",
            "2.4.1rc2",
            "2.5.0",
            "2.5.0rc1",
            "2.5.1",
            "2.5.1rc1",
            "2.5.2",
            "2.5.2rc1",
            "2.6.0",
            "2.6.0rc1",
            "2.7.0",
            "2.7.0rc1",
            "3.0.0rc1",
            "3.0.0rc2"
          ],
          "database_specific": {
            "source": "https://github.com/github/advisory-database/blob/main/advisories/github-reviewed/2022/08/GHSA-746v-hfh2-xphm/GHSA-746v-hfh2-xphm.json"
          }
        }
      ],
      "references": [
        {
          "type": "ADVISORY",
          "url": "https://nvd.nist.gov/vuln/detail/CVE-2022-38362"
        },
        {
          "type": "WEB",
          "url": "https://lists.apache.org/thread/614p38nf4gbk8xhvnskj9b1sqo2dknkb"
        },
        {
          "type": "WEB",
          "url": "http://www.openwall.com/lists/oss-security/2022/08/16/1"
        }
      ],
      "database_specific": {
        "cwe_ids": [],
        "github_reviewed": true,
        "github_reviewed_at": "2023-04-13T17:53:42Z",
        "nvd_published_at": "2022-08-16T14:15:00Z",
        "severity": "HIGH",
        "conda-forge": {
          "package": "apache-airflow-providers-docker",
          "purl": "pkg:conda/apache-airflow-providers-docker?channel=conda-forge",
          "source_purls": [
            "pkg:pypi/apache-airflow-providers-docker"
          ],
          "affected_versions": [
            "1.0.1",
            "1.0.2",
            "1.2.0",
            "2.0.0",
            "2.1.0",
            "2.1.1",
            "2.2.0",
            "2.3.0",
            "2.4.0",
            "2.4.1",
            "2.5.0",
            "2.5.2",
            "2.6.0",
            "2.7.0"
          ],
          "conda_versions_total": 59,
          "derived_by": "purl-associator/scripts.cve_match",
          "generated_at": "2026-05-23T06:36:22+00:00"
        }
      },
      "severity": [
        {
          "type": "CVSS_V3",
          "score": "CVSS:3.1/AV:N/AC:L/PR:L/UI:N/S:U/C:H/I:H/A:H",
          "score_num": 8.8
        }
      ]
    }
  ]
}
