{
  "schema_version": 1,
  "package": "python-docx",
  "purls": [
    "pkg:pypi/python-docx"
  ],
  "generated_at": "2026-05-23T06:03:35+00:00",
  "conda_versions_total": 11,
  "advisories": [
    {
      "schema_version": "1.7.3",
      "id": "GHSA-34wj-p5jm-2p96",
      "published": "2022-05-13T01:06:10Z",
      "modified": "2024-10-25T21:25:18.720989Z",
      "aliases": [
        "CVE-2016-5851",
        "PYSEC-2016-21"
      ],
      "summary": "Improper Restriction of XML External Entity Reference in python-docx",
      "details": "python-docx before 0.8.6 allows context-dependent attackers to conduct XML External Entity (XXE) attacks via a crafted document.",
      "affected": [
        {
          "package": {
            "name": "python-docx",
            "ecosystem": "PyPI",
            "purl": "pkg:pypi/python-docx"
          },
          "ranges": [
            {
              "type": "ECOSYSTEM",
              "events": [
                {
                  "introduced": "0"
                },
                {
                  "fixed": "0.8.6"
                }
              ]
            }
          ],
          "versions": [
            "0.3.0a1",
            "0.3.0a2",
            "0.3.0a3",
            "0.3.0a4",
            "0.3.0a5",
            "0.3.0dev1",
            "0.4.0",
            "0.5.0",
            "0.5.1",
            "0.5.2",
            "0.5.3",
            "0.6.0",
            "0.7.0",
            "0.7.1",
            "0.7.2",
            "0.7.3",
            "0.7.4",
            "0.7.5",
            "0.7.6",
            "0.8.0",
            "0.8.1",
            "0.8.2",
            "0.8.3",
            "0.8.4",
            "0.8.5"
          ],
          "database_specific": {
            "last_known_affected_version_range": "<= 0.8.5",
            "source": "https://github.com/github/advisory-database/blob/main/advisories/github-reviewed/2022/05/GHSA-34wj-p5jm-2p96/GHSA-34wj-p5jm-2p96.json"
          }
        }
      ],
      "references": [
        {
          "type": "ADVISORY",
          "url": "https://nvd.nist.gov/vuln/detail/CVE-2016-5851"
        },
        {
          "type": "WEB",
          "url": "https://github.com/python-openxml/python-docx/commit/61b40b161b64173ab8e362aec1fd197948431beb"
        },
        {
          "type": "ADVISORY",
          "url": "https://github.com/advisories/GHSA-34wj-p5jm-2p96"
        },
        {
          "type": "WEB",
          "url": "https://github.com/pypa/advisory-database/tree/main/vulns/python-docx/PYSEC-2016-21.yaml"
        },
        {
          "type": "PACKAGE",
          "url": "https://github.com/python-openxml/python-docx"
        },
        {
          "type": "WEB",
          "url": "https://github.com/python-openxml/python-docx/blob/v0.8.6/HISTORY.rst"
        },
        {
          "type": "WEB",
          "url": "https://lists.fedoraproject.org/archives/list/package-announce%40lists.fedoraproject.org/message/6FFMOH7ZPOPQWNJGUZOS5LXX4MGNRXXT"
        },
        {
          "type": "WEB",
          "url": "https://lists.fedoraproject.org/archives/list/package-announce%40lists.fedoraproject.org/message/XU2WSYRNB7CLBBFCGSX34XHACTA2SWDZ"
        },
        {
          "type": "WEB",
          "url": "https://lists.fedoraproject.org/archives/list/package-announce@lists.fedoraproject.org/message/6FFMOH7ZPOPQWNJGUZOS5LXX4MGNRXXT"
        },
        {
          "type": "WEB",
          "url": "https://lists.fedoraproject.org/archives/list/package-announce@lists.fedoraproject.org/message/XU2WSYRNB7CLBBFCGSX34XHACTA2SWDZ"
        },
        {
          "type": "WEB",
          "url": "https://web.archive.org/web/20170214030949/http://www.securityfocus.com/bid/91485"
        },
        {
          "type": "WEB",
          "url": "http://www.openwall.com/lists/oss-security/2016/06/28/7"
        },
        {
          "type": "WEB",
          "url": "http://www.openwall.com/lists/oss-security/2016/06/28/8"
        },
        {
          "type": "WEB",
          "url": "http://www.securityfocus.com/bid/91485"
        }
      ],
      "database_specific": {
        "cwe_ids": [
          "CWE-611"
        ],
        "github_reviewed": true,
        "github_reviewed_at": "2022-07-06T19:44:36Z",
        "nvd_published_at": "2016-12-21T22:59:00Z",
        "severity": "HIGH",
        "conda-forge": {
          "package": "python-docx",
          "purl": "pkg:conda/python-docx?channel=conda-forge",
          "source_purls": [
            "pkg:pypi/python-docx"
          ],
          "affected_versions": [],
          "conda_versions_total": 11,
          "derived_by": "purl-associator/scripts.cve_match",
          "generated_at": "2026-05-23T06:03:35+00:00"
        }
      },
      "severity": [
        {
          "type": "CVSS_V3",
          "score": "CVSS:3.1/AV:N/AC:L/PR:N/UI:R/S:U/C:H/I:H/A:H"
        },
        {
          "type": "CVSS_V4",
          "score": "CVSS:4.0/AV:N/AC:L/AT:N/PR:N/UI:P/VC:H/VI:H/VA:H/SC:N/SI:N/SA:N"
        }
      ]
    },
    {
      "schema_version": "1.7.3",
      "id": "PYSEC-2016-21",
      "published": "2016-12-21T22:59:00Z",
      "modified": "2023-11-08T03:58:32.000630Z",
      "aliases": [
        "CVE-2016-5851",
        "GHSA-34wj-p5jm-2p96"
      ],
      "details": "python-docx before 0.8.6 allows context-dependent attackers to conduct XML External Entity (XXE) attacks via a crafted document.",
      "affected": [
        {
          "package": {
            "name": "python-docx",
            "ecosystem": "PyPI",
            "purl": "pkg:pypi/python-docx"
          },
          "ranges": [
            {
              "type": "ECOSYSTEM",
              "events": [
                {
                  "introduced": "0"
                },
                {
                  "fixed": "0.8.6"
                }
              ]
            }
          ],
          "versions": [
            "0.3.0a1",
            "0.3.0a2",
            "0.3.0a3",
            "0.3.0a4",
            "0.3.0a5",
            "0.3.0dev1",
            "0.4.0",
            "0.5.0",
            "0.5.1",
            "0.5.2",
            "0.5.3",
            "0.6.0",
            "0.7.0",
            "0.7.1",
            "0.7.2",
            "0.7.3",
            "0.7.4",
            "0.7.5",
            "0.7.6",
            "0.8.0",
            "0.8.1",
            "0.8.2",
            "0.8.3",
            "0.8.4",
            "0.8.5"
          ],
          "database_specific": {
            "source": "https://github.com/pypa/advisory-database/blob/main/vulns/python-docx/PYSEC-2016-21.yaml"
          }
        }
      ],
      "references": [
        {
          "type": "WEB",
          "url": "https://github.com/python-openxml/python-docx/blob/v0.8.6/HISTORY.rst"
        },
        {
          "type": "WEB",
          "url": "http://www.securityfocus.com/bid/91485"
        },
        {
          "type": "WEB",
          "url": "http://www.openwall.com/lists/oss-security/2016/06/28/8"
        },
        {
          "type": "WEB",
          "url": "http://www.openwall.com/lists/oss-security/2016/06/28/7"
        },
        {
          "type": "ADVISORY",
          "url": "https://github.com/advisories/GHSA-34wj-p5jm-2p96"
        }
      ],
      "database_specific": {
        "conda-forge": {
          "package": "python-docx",
          "purl": "pkg:conda/python-docx?channel=conda-forge",
          "source_purls": [
            "pkg:pypi/python-docx"
          ],
          "affected_versions": [],
          "conda_versions_total": 11,
          "derived_by": "purl-associator/scripts.cve_match",
          "generated_at": "2026-05-23T06:03:35+00:00"
        }
      }
    }
  ]
}
